5099873089798,Jack Daniel's Tennessee Whiskey,Jack Daniel's,https://media.real-onlineshop.de/images/items/1024x1024/a78dfaccb8590e8b9a606df01fbab0d8.jpg, Das Motto von Jack Daniel lautete Everyday we make it we'll make it the best we can. Für ihn bedeutete das seinen Whiskey Tropfen für Tropfen durch eine drei Meter dicke Holzkohleschicht vom Zuckerahorn zu filtern.,700,40,USA,Vanille Karamell Holzkohle,Süß,Rock,Beginner
4901777275669,Hibiki Japanese Harmony Whisky,Hibiki,https://www.hawesko.de/images/5d2f600b00389c79864515dfecaef9e6e1a1dfa2/ProductDetailGift/320x2/suntory-hibiki-harmony-blended-japenese-whisky-spirituosen.png,Ein Whisky aus Fernost! Der Duft ist leicht floral man meint Litschi zu spüren untermalt mit etwas kräuteriger Würze. Am Gaumen ist der Suntory Hibiki leicht süß und fruchtig mit Anklängen an Orange helle Schokolade und Honig.,700,43,Japan,Litschi Schokolade Orange Honig,Süß,Jazz,Fortgeschritten
4901777020313,Yamazaki 12 Jahre,Yamazaki,https://static.whiskybase.com/storage/whiskies/1/6/4100/278194-big.jpg,Shinjiro Torii gründete die erste Brennerei Japans im Jahre 1923. Im klaissichen Potstill Verfahren werden die japanischen Whisky von Yamazaki hergestellt. Dieser Whisky lagert insgesamt 12 Jahre in drei verschiedenen Fässern.,700,43,Japan,Vanille Trockenfrüchte Honig,Süß,Jazz,Profi
4901777303553,Suntory Toki,Suntory,https://shop.iowaabd.com/images/product-shots/15982-1.jpg,Suntory Toki ist ein Blend aus den drei Brennereien von Suntory. Der Name symbolisiert die Verbindung von Vergangenheit Gegenwart und Zukunft. Toki setzt seine Schwerpunkte auf den Single Malt von Hakushu und den schweren Chita Grain.,700,43,Japan,Apfel Honig Zitrus,Süß,Jazz,Beginner
9346943000389,Starward Two-Fold,Starward,https://www.weisshaus.de/media/image/cf/8f/9e/t-84B86087785807E30146CB7639B86533_600x600.jpg,Der Starward Two-Fold vermählt das für Australien typische Weizen und Gerstenmalz. Das intensive Klima von Melbourne sorgt bei der Reifung für den besonderen Geschmack des Whiskys.,700,40,Australien,Apfel Beeren,Fruchtig,Rock,Fortgeschritten
5000299613122,J. P. Wiser's 18 Jahre,Wiser’s,https://www.liquormarts.ca/sites/mlcc_public_website/files/styles/product_fullsize/public/product/10967_product_front.png?itok=iSoxQKmm,J.P. Wiser's wurde bereits im späten 18. Jahrhundert gegründet. Diese Abfüllung ist mit 18 Jahren außergewöhnlich alt für einen kanadischen Whisky. Master Blender Don Livermore suchte dafür nur die besten Fässer aus.,700,40,Kanada,Karamell Apfel Holz,Fruchtig,Rock,Beginner
5000299613085,LOT 40 Canadian Rye Whisky,Wiser’s,https://www.whisky.de/fileadmin/web_data/tx_datamintsflaschendb/flaschen/1151223x.jpg,Lot 40 wurde für kanadischen Whisky eher unüblich, in Pot Stills gebrannt und in frischen Eichenfässern gereift. Anschließend wurde der Rye als Small Batch abgefüllt. Die Verwendung von 100% Roggen macht ihn geschmacklich besonders würzig und körperreich.,700,43,Kanada,Pfeffer Roggen Walnuss,Getreidig,Pop,Beginner
5010327000176,Glenfiddich Single Malt Scotch Whisky 12,Glenfiddich,https://media.real-onlineshop.de/images/items/1024x1024/3391c55dbbc3f979bc030dfaed159b84.jpg,Der Glenfiddich 12 Jahre alte Whisky ist der meistverkaufteste Single Malt der Welt. Reift in amerikanischen Bourbonfässern und spanischen Sherryfässern verleihen Glenfiddich 12 Jahre eine wunderbare Balance aus intensiven frischen und fruchtigen Aromen.,700,40,Schottland,Birne Sahne Malz,Getreidig,Pop,Fortgeschritten
5010327525822,Balvenie Double Wood 17 Jahre,Balvenie,https://images-na.ssl-images-amazon.com/images/I/71a0Ww3zQBL._AC_SL1080_.jpg,Der 17-jährige Balvenie Doube Wood wurde wie sein jüngerer Bruder in zwei verschiedenen Fässern gereift. Die erste Reifung erfolgte in amerikanischen Eichenfässern die zweite in europäischen Ex-Sherry-Fässern.,700,43,Schottland,Zimt Mandel Vanille,Getreidig,Pop,Profi